{
  "$schema": "./schema/health.schema.json",
  "version": 1,
  "description": "受信停止監視（診断のみ）の契約。thresholds は両実装の既定値、scenarios は単調時計上の SessionHealthMonitor の判定系列。at は ms の単調時刻で、壁時計は入力に含まれない。detections はその evaluate で新たに発火したもの（kind の定義順）。",
  "thresholds": {
    "captureStallMs": 3000,
    "sendStallMs": 10000,
    "receiveStallMs": 20000,
    "sourceStallMs": 20000,
    "translationStallMs": 15000,
    "silenceMs": 5000,
    "connectGraceMs": 10000,
    "expiryNearMs": 120000,
    "audioActivityPeakFloor": 0.005
  },
  "scenarios": [
    {
      "name": "normal active flow",
      "steps": [
        {
          "at": 0,
          "op": "begin",
          "generation": 1,
          "epoch": 1,
          "isRecovery": false
        },
        {
          "at": 300,
          "op": "select",
          "lane": "en"
        },
        {
          "at": 1000,
          "op": "capture",
          "active": true
        },
        {
          "at": 2000,
          "op": "capture",
          "active": true
        },
        {
          "at": 3000,
          "op": "capture",
          "active": true
        },
        {
          "at": 4000,
          "op": "capture",
          "active": true
        },
        {
          "at": 5000,
          "op": "capture",
          "active": true
        },
        {
          "at": 6000,
          "op": "capture",
          "active": true
        },
        {
          "at": 7000,
          "op": "capture",
          "active": true
        },
        {
          "at": 8000,
          "op": "capture",
          "active": true
        },
        {
          "at": 9000,
          "op": "capture",
          "active": true
        },
        {
          "at": 10000,
          "op": "capture",
          "active": true
        },
        {
          "at": 11000,
          "op": "capture",
          "active": true
        },
        {
          "at": 12000,
          "op": "capture",
          "active": true
        },
        {
          "at": 13000,
          "op": "capture",
          "active": true
        },
        {
          "at": 14000,
          "op": "capture",
          "active": true
        },
        {
          "at": 15000,
          "op": "capture",
          "active": true
        },
        {
          "at": 16000,
          "op": "capture",
          "active": true
        },
        {
          "at": 17000,
          "op": "capture",
          "active": true
        },
        {
          "at": 18000,
          "op": "capture",
          "active": true
        },
        {
          "at": 19000,
          "op": "capture",
          "active": true
        },
        {
          "at": 20000,
          "op": "capture",
          "active": true
        },
        {
          "at": 21000,
          "op": "capture",
          "active": true
        },
        {
          "at": 22000,
          "op": "capture",
          "active": true
        },
        {
          "at": 23000,
          "op": "capture",
          "active": true
        },
        {
          "at": 24000,
          "op": "capture",
          "active": true
        },
        {
          "at": 25000,
          "op": "capture",
          "active": true
        },
        {
          "at": 26000,
          "op": "capture",
          "active": true
        },
        {
          "at": 27000,
          "op": "capture",
          "active": true
        },
        {
          "at": 28000,
          "op": "capture",
          "active": true
        },
        {
          "at": 29000,
          "op": "capture",
          "active": true
        },
        {
          "at": 30000,
          "op": "capture",
          "active": true
        },
        {
          "at": 31000,
          "op": "capture",
          "active": true
        },
        {
          "at": 32000,
          "op": "capture",
          "active": true
        },
        {
          "at": 33000,
          "op": "capture",
          "active": true
        },
        {
          "at": 34000,
          "op": "capture",
          "active": true
        },
        {
          "at": 35000,
          "op": "capture",
          "active": true
        },
        {
          "at": 36000,
          "op": "capture",
          "active": true
        },
        {
          "at": 37000,
          "op": "capture",
          "active": true
        },
        {
          "at": 38000,
          "op": "capture",
          "active": true
        },
        {
          "at": 39000,
          "op": "capture",
          "active": true
        },
        {
          "at": 40000,
          "op": "capture",
          "active": true
        },
        {
          "at": 41000,
          "op": "capture",
          "active": true
        },
        {
          "at": 42000,
          "op": "capture",
          "active": true
        },
        {
          "at": 43000,
          "op": "capture",
          "active": true
        },
        {
          "at": 44000,
          "op": "capture",
          "active": true
        },
        {
          "at": 45000,
          "op": "capture",
          "active": true
        },
        {
          "at": 46000,
          "op": "capture",
          "active": true
        },
        {
          "at": 47000,
          "op": "capture",
          "active": true
        },
        {
          "at": 48000,
          "op": "capture",
          "active": true
        },
        {
          "at": 49000,
          "op": "capture",
          "active": true
        },
        {
          "at": 50000,
          "op": "capture",
          "active": true
        },
        {
          "at": 51000,
          "op": "capture",
          "active": true
        },
        {
          "at": 52000,
          "op": "capture",
          "active": true
        },
        {
          "at": 53000,
          "op": "capture",
          "active": true
        },
        {
          "at": 54000,
          "op": "capture",
          "active": true
        },
        {
          "at": 55000,
          "op": "capture",
          "active": true
        },
        {
          "at": 56000,
          "op": "capture",
          "active": true
        },
        {
          "at": 57000,
          "op": "capture",
          "active": true
        },
        {
          "at": 58000,
          "op": "capture",
          "active": true
        },
        {
          "at": 59000,
          "op": "capture",
          "active": true
        },
        {
          "at": 60000,
          "op": "capture",
          "active": true
        },
        {
          "at": 1000,
          "op": "send"
        },
        {
          "at": 2000,
          "op": "send"
        },
        {
          "at": 3000,
          "op": "send"
        },
        {
          "at": 4000,
          "op": "send"
        },
        {
          "at": 5000,
          "op": "send"
        },
        {
          "at": 6000,
          "op": "send"
        },
        {
          "at": 7000,
          "op": "send"
        },
        {
          "at": 8000,
          "op": "send"
        },
        {
          "at": 9000,
          "op": "send"
        },
        {
          "at": 10000,
          "op": "send"
        },
        {
          "at": 11000,
          "op": "send"
        },
        {
          "at": 12000,
          "op": "send"
        },
        {
          "at": 13000,
          "op": "send"
        },
        {
          "at": 14000,
          "op": "send"
        },
        {
          "at": 15000,
          "op": "send"
        },
        {
          "at": 16000,
          "op": "send"
        },
        {
          "at": 17000,
          "op": "send"
        },
        {
          "at": 18000,
          "op": "send"
        },
        {
          "at": 19000,
          "op": "send"
        },
        {
          "at": 20000,
          "op": "send"
        },
        {
          "at": 21000,
          "op": "send"
        },
        {
          "at": 22000,
          "op": "send"
        },
        {
          "at": 23000,
          "op": "send"
        },
        {
          "at": 24000,
          "op": "send"
        },
        {
          "at": 25000,
          "op": "send"
        },
        {
          "at": 26000,
          "op": "send"
        },
        {
          "at": 27000,
          "op": "send"
        },
        {
          "at": 28000,
          "op": "send"
        },
        {
          "at": 29000,
          "op": "send"
        },
        {
          "at": 30000,
          "op": "send"
        },
        {
          "at": 31000,
          "op": "send"
        },
        {
          "at": 32000,
          "op": "send"
        },
        {
          "at": 33000,
          "op": "send"
        },
        {
          "at": 34000,
          "op": "send"
        },
        {
          "at": 35000,
          "op": "send"
        },
        {
          "at": 36000,
          "op": "send"
        },
        {
          "at": 37000,
          "op": "send"
        },
        {
          "at": 38000,
          "op": "send"
        },
        {
          "at": 39000,
          "op": "send"
        },
        {
          "at": 40000,
          "op": "send"
        },
        {
          "at": 41000,
          "op": "send"
        },
        {
          "at": 42000,
          "op": "send"
        },
        {
          "at": 43000,
          "op": "send"
        },
        {
          "at": 44000,
          "op": "send"
        },
        {
          "at": 45000,
          "op": "send"
        },
        {
          "at": 46000,
          "op": "send"
        },
        {
          "at": 47000,
          "op": "send"
        },
        {
          "at": 48000,
          "op": "send"
        },
        {
          "at": 49000,
          "op": "send"
        },
        {
          "at": 50000,
          "op": "send"
        },
        {
          "at": 51000,
          "op": "send"
        },